datetime,label,title,link,content,words_count
27/04/2024 15:59,Fashion_Beauty,The Power of Personal Style: A Symphony of You,https://pages.daraz.pk/wow/gcp/daraz/channel/pk/-beauty-station/beauty-tools?spm=a2a0e.tm800127096.3456599500.5.248a49200OUhAc&pfilter=1010Badge_206366,"Fashion isn't merely dictated by trends plastered across glossy magazine pages; it's a potent language allowing you to express your unique symphony of personality, interests, and even mood. Imagine yourself walking into a room, and before you even utter a word, your clothing choices speak volumes about who you are. Developing your personal style is a beautiful journey of self-discovery, a process that unfolds with time and a dash of experimentation. Don't be afraid to break the mold, drawing inspiration from iconic fashion figures who dared to be different. Think of Coco Chanel, who revolutionized women's fashion with comfortable yet chic designs, or David Bowie, whose flamboyant costumes became an extension of his artistic persona. Embrace the freedom to mix and match unexpected pieces, like a flowy maxi skirt with a graphic tee, creating a fusion of styles that reflects your individuality. Explore various silhouettes – a tailored jumpsuit for a powerful statement when you need to command attention, or a relaxed bohemian dress for a carefree vibe that exudes effortless beauty. Ultimately, embrace what ignites confidence within you. Maybe it's a pop of color that reflects your vibrant personality, or a classic silhouette that exudes timeless elegance. Remember, fashion is a canvas, and you are the artist – create a masterpiece that reflects the truest essence of you. As the renowned designer Miuccia Prada once said, ""What you wear is how you present yourself to the world, especially today when human contacts are so quick. Fashion is instant language."" So, speak your truth through your clothing choices, and let your personal style be a symphony that resonates with your inner self. After all, fashion allows you to curate an outward expression that reflects the vibrant melody playing within your soul.",311
27/04/2024 15:59,Fashion_Beauty,The Ever-Evolving Landscape of Fashion: A Tapestry Woven through Time,https://pages.daraz.pk/wow/gcp/daraz/channel/pk/-the-fashion-store/bags?spm=a2a0e.tm800133185.4591583930.6.7f337b0fCa5Adz,"Fashion is a dynamic entity, constantly in flux, influenced by cultural shifts, historical moments, and even the ever-evolving landscape of technology. From the extravagant ballgowns of the 18th century, symbolizing wealth and social standing, to the rise of utilitarian and comfortable athleisure in the 21st century, reflecting a more active and casual lifestyle, fashion serves as a mirror to the times we live in. Consider the flapper dresses of the 1920s, a symbol of women's liberation and rebellion against societal norms, a movement fueled by newfound independence after World War I. Or, look at the rise of power suits in the 1980s, reflecting the growing power of women in the workplace as they shattered glass ceilings and demanded equality. Today, with a growing focus on environmental consciousness, sustainability and ethical production are becoming prominent considerations for both fashion houses and discerning consumers. Innovative materials derived from recycled plastic or organic fabrics are being used, and production processes are being scrutinized to minimize environmental impact. Fashion is no longer just about aesthetics; it's a conversation starter about social issues and environmental responsibility. It's a powerful tool for activism, with designers using their platforms to raise awareness about climate change, fair labor practices, and social justice issues. The ever-evolving landscape of fashion reflects the ever-changing world around us, and its influence extends far beyond clothing trends. It's a reflection of our cultural zeitgeist, a conversation starter about pressing issues, and a powerful tool for self-expression.",289
27/04/2024 15:59,Fashion_Beauty,What is Fashion?,https://pages.daraz.pk/wow/gcp/daraz/channel/pk/-the-fashion-store/winter-wear-western-wear?spm=a2a0e.tm800133185.4591583930.4.7f337b0fTtOvCq&pfilter=1010Badge_202807,"Fashion is a term that is given to enhancing the personal style of clothing. People these days no longer want to dress up casually but they want to add an element of fashion in their style that distinguishes them from others. Fashion is inspired by celebrities and designers that keep on experimenting. One style becomes popular at a time and it is called fashion of that time frame. Some fashion elements are timeless that aren’t bounded by time but remain fashionable forever. Apart from clothing, footwear, accessories and compatible hairstyle are also a part of fashion.",376
27/04/2024 15:59,Fashion_Beauty,Enhancing Facial Proportions with Dermal Fillers: Know Its Benefits and Safety,https://pages.daraz.pk/wow/gcp/daraz/channel/pk/-the-fashion-store/accessories?spm=a2a0e.tm800133185.4591583930.10.7f337b0f2sarpV,"Explore how to enhance your facial proportions without any surgical process. Read this article to understand what expert says about it.In the ever-evolving world of cosmetic upgrade, a popular technique called facial contouring with dermal fillers, helps you enhance your facial features and make you look younger. The quest for facial symmetry and balanced look has long been in demand and now, it is possible to get it done without having to undergo surgery. These methods can reshape your face without surgery, giving you a more defined look. This article explores how facial contouring with dermal fillers works, its benefits, and things to consider before trying it.Facial proportions play a vital role in figuring out how attractive you might be seen as. Dr Kapoor said, “Symmetry, stability, and concord among facial functions make a contribution to an attractive appearance. However, different factors which include genetics, ageing, and way of life patterns and selections can have an effect on facial proportions, leading to asymmetries or less quantity in some regions.”",294
27/04/2024 15:59,Fashion_Beauty,Areas Addressed with Facial Contouring,https://pages.daraz.pk/wow/gcp/daraz/channel/pk/-the-fashion-store/hijabs-and-abayas?spm=a2a0e.tm800133185.4591583930.9.7f337b0fTGMD7l&pfilter=1010Badge_202807,"Facial contouring can address a variety of areas to enhance your facial features and create a more youthful appearance. Cheeks are a key area for facial shaping. As we age, cheeks can lose volume, leading to a sunken appearance and more prominent smile lines. Dermal fillers can be used to plump up the cheeks, lifting them for a more youthful and sculpted look. The jawline plays a significant role in defining your face shape. Facial contouring with dermal fillers can enhance your jawline, creating a sharper definition and improving overall facial balance. This can result in a more youthful and sculpted appearance. A weak or recessed chin can throw off the balance of your entire face. Dermal fillers offer a solution, adding volume to the chin and projecting it forward. This creates a more balanced profile and enhances facial harmony. Temples are another area susceptible to volume loss, causing the skin to appear hollow. Facial contouring can address this by filling the temples with dermal fillers, restoring a youthful fullness and smoothing out the appearance. The under-eye area is a common concern for many. Dark circles and hollowness can make you look tired and older. Facial contouring with dermal fillers can address both issues. Fillers add volume to the under-eye area, reducing the appearance of hollowness and minimizing the shadows that contribute to dark circles. This results in a refreshed and more youthful under-eye appearance.",249
27/04/2024 15:59,Fashion_Beauty,Ways To Clean Your Makeup Kit,https://pages.daraz.pk/wow/gcp/daraz/channel/pk/-the-fashion-store/women-jewellery?spm=a2a0e.tm800133185.4591583930.8.7f337b0fAlNUNh&pfilter=1010Badge_202807,"Maintaining a clean and sanitized makeup kit isn't just about aesthetics; it's crucial for promoting healthy skin and ensuring flawless makeup application. Makeup brushes, sponges, and applicators come into direct contact with your face throughout the day, and if not cleaned regularly, can become breeding grounds for bacteria, oil, and residual makeup. This buildup can lead to breakouts, irritation, and even the spread of infection. The good news is that maintaining a hygienic beauty arsenal is a simple process. For brushes, a deep clean every 1-2 weeks is recommended. You can use a gentle brush cleaner, mild dish soap, or a DIY solution of warm water and baby shampoo. Dip the brush head (avoid submerging the metal part) into the solution, swirl the bristles to release makeup, rinse thoroughly, and reshape the brush head while laying it flat to air dry. Cream and liquid products like foundations and concealers are more susceptible to bacteria due to their moist environment. To prevent unwanted microbes, sanitize them with specialized makeup sanitizing sprays containing around 70% alcohol, or create a gentle DIY solution with distilled water and a few drops of tea tree oil. Disposable applicators for mascara and lip gloss are a great way to prevent cross-contamination. Powder-based products like eyeshadows can be refreshed with a light alcohol spritz, but be cautious not to oversaturate them. Finally, don't forget to wipe down the exterior packaging of your makeup products with a gentle disinfectant or mild soap and water to remove external contaminants. By incorporating these simple cleaning routines into your beauty regimen, you can maintain a clean and hygienic makeup kit, promoting healthy skin and ensuring a flawless makeup application every time.",298
27/04/2024 15:59,Fashion_Beauty,Maintain a Clean Makeup Bag,https://pages.daraz.pk/wow/gcp/daraz/channel/pk/-the-fashion-store/jewellery-mens?spm=a2a0e.tm800153859.9605157410.7.4d8f581a9fsMC7&pfilter=1010Badge_202807,"Your makeup bag can accumulate dust and debris, so it's essential to clean it regularly. Empty the contents, turn the bag inside out, and wipe it down with a damp cloth. Ensure it dries completely in the open air before keeping back your makeup items.Pencils, such as eyeliners and lip liners, should be regularly sharpened to remove any potential bacteria or fungi. Use a dedicated sharpener for each pencil type and clean the sharpener periodically.Before delving into your makeup application, ensure your hands are clean. Washing your hands helps prevent the transfer of bacteria to your face and makeup products. It's a simple yet effective step in maintaining a hygienic makeup routine.Cosmetic products come with a limited shelf life, and the usage of expired products may result in skin irritation or infections. Regularly check the expiration dates of your products, and dispose of anything that has passed its prime.For professional makeup artists or enthusiasts with an extensive collection, investing in a makeup sanitising machine might be beneficial. These devices use UV light or other sanitising methods to eliminate bacteria from makeup products without altering their consistency.[Disclaimer: This article contains information for informational purposes only, hence, we advise you to consult your expert if you are dealing with any skin issues.]",280
27/04/2024 15:59,Fashion_Beauty,Unveiling the Beauty Within: A Journey of Self-Love and Confidence,https://pages.daraz.pk/wow/gcp/daraz/channel/pk/-the-fashion-store/pret?spm=a2a0e.tm800133185.4591583930.3.7f337b0fULVfwT,"True beauty transcends the superficial application of makeup or the latest fashion trends. It's a culmination of self-acceptance, embracing your unique flaws, and radiating confidence from within. This journey begins with prioritizing your well-being. Cultivate a healthy lifestyle that nourishes your body and soul. Prioritize quality sleep for a radiant complexion, incorporate a balanced diet rich in essential nutrients, and find an exercise routine that sparks joy. Embrace movement, whether it's a vigorous workout or a mindful yoga session.Complement these efforts with a personalized skincare routine that addresses your unique needs. Whether it's battling acne breakouts, combating dryness, or mitigating the signs of aging, a consistent skincare regimen is key. Remember, less is often more. Consult a dermatologist if needed, and choose products formulated with gentle yet effective ingredients. Beyond skincare, explore natural beauty hacks like incorporating facial massage or gua sha techniques for improved circulation and a natural glow.Fragrance has the power to evoke emotions, create lasting memories, and add a touch of personal expression to your daily routine. The right scent can boost your confidence, uplift your mood, and leave a signature impression. Imagine walking into a room and leaving behind a trail of captivating fragrance – a subtle floral for a springtime day, a warm and musky scent for a night out, or a refreshing citrus for a burst of energy.The world of fragrances is vast and diverse, offering a symphony of notes to explore. Floral scents, with their delicate and feminine allure, are timeless favorites. Rose, jasmine, and lavender offer a sense of romance and sophistication. Gourmand fragrances, inspired by delicious treats, are playful and enticing. Think vanilla, caramel, or chocolate for a touch of sweetness. Woody notes, with their earthy and grounding qualities, exude a sense of strength and confidence. Sandalwood, cedarwood, and vetiver are popular choices in this category.Finding your signature scent is a personal journey. Experiment with different fragrance families and discover what resonates with your personality. Consider the occasion, the mood you want to create, and the season when selecting a fragrance. Apply perfume strategically – behind the ears, on your wrists, or at the nape of your neck – where your pulse points naturally warm, amplifying the scent. Remember, a little goes a long way – a light spritz will leave a lasting impression without being overpowering.",382
27/04/2024 15:59,Fashion_Beauty,Sustainable Fashion: Weaving a Greener Future for Style,https://pages.daraz.pk/wow/gcp/daraz/channel/pk/-the-fashion-store/footwear?spm=a2a0e.tm800133185.4591583930.7.7f337b0fULVfwT,"The fashion industry has a significant environmental impact. Fast fashion, characterized by mass production and disposable clothing made from low-quality materials, contributes to pollution and landfill waste. Thankfully, a shift towards sustainable fashion is gaining momentum. Consumers are becoming increasingly conscious of the ethical and environmental implications of their clothing choices.Sustainable fashion prioritizes eco-friendly practices throughout the garment lifecycle. This includes using recycled materials like organic cotton, hemp, or recycled plastic. Sustainable brands also focus on responsible production processes that minimize water usage, reduce pollution, and ensure fair labor practices. Look for certifications like OEKO-TEX or GOTS that guarantee responsible and sustainable production.Beyond choosing sustainable brands, there are ways to be more mindful in your daily life. Invest in quality, timeless pieces that you'll cherish for years to come. Embrace the art of clothing repair – learn basic sewing skills to mend tears or replace buttons. Organize clothing swaps with friends to give pre-loved garments a new lease on life. Consider buying second-hand clothing, which reduces demand for new production and allows you to discover unique pieces at a fraction of the cost.Ethical production ensures fair wages, safe working conditions, and respect for human rights throughout the fashion supply chain. Consumers are becoming increasingly aware of the human cost of cheap clothing, the garment workers who toil long hours in unsafe conditions for meager wages. Supporting brands that prioritize ethical production allows you to make a conscious choice towards a more responsible fashion industry.Ethical production encompasses fair wages for workers, ensuring they can afford a decent standard of living. It also means safe working conditions, with proper ventilation, fire safety measures, and access to basic hygiene facilities. Additionally, ethical production prohibits child labor and promotes freedom of association, allowing workers the right to organize and advocate for their rights.Look for brands that are transparent about their production practices and source materials. Many brands are working with Fair Trade Certified or B Corporation certifications, which assure ethical production and social responsibility. By choosing ethical brands, you not only feel good about your clothing choices, but also contribute to positive change within the fashion industry.",352
27/04/2024 15:59,Fashion_Beauty,"Men's Fashion: Breaking the Boundaries, Defining the New Era",https://pages.daraz.pk/wow/gcp/daraz/channel/pk/-the-fashion-store/formal-wear?spm=a2a0e.tm800153859.9605157410.1.4d8f581apTXxy1&pfilter=1010Badge_202807,"Men's fashion is experiencing a thrilling period of evolution. Gone are the days of rigid conformity and limited silhouettes. Today's menswear embraces individuality, experimentation, and a willingness to challenge traditional notions of masculinity. This newfound freedom allows men to express their unique personalities through their clothing choices, blurring the lines between classic and contemporary, formal and casual. One of the most significant shifts is the rise of gender-fluid fashion. Masculinity is no longer defined by a narrow set of clothing styles. Men are embracing traditionally ""feminine"" elements like floral prints, pastel colors, and flowing silhouettes. This isn't about losing masculinity; it's about expanding its definition. It's about confidence in expressing yourself authentically, regardless of societal expectations. Comfort takes center stage in contemporary menswear. Tailored suits still hold a place for formal occasions, but they've become more relaxed in their fit. Think slimmer cuts without sacrificing movement, and the incorporation of comfortable fabrics like stretch cotton and linen blends. Athleisure continues to influence everyday wear, with joggers and hoodies taking their place alongside jeans and chinos. The key here is achieving a balance – blending comfort with a touch of sophistication. Sustainability is making its mark on men's fashion as well. Eco-conscious consumers are opting for brands that prioritize recycled materials, organic fabrics, and responsible production practices. Choosing ethically sourced clothing allows men to make a statement about their values while looking sharp. The new era of men's fashion celebrates individuality and self-expression. It's about breaking free from rigid expectations and embracing a more fluid and diverse approach to style. Whether it's a classic suit with a modern twist, a bold statement piece, or a comfortable yet stylish casual outfit, men's fashion allows room for personal exploration and the freedom to define your own sense of style.",390
27/04/2024 15:59,Fashion_Beauty,The Art of Layering: Mastering the Symphony of Textures ,https://pages.daraz.pk/wow/gcp/daraz/channel/pk/-beauty-station/hair-care?spm=a2a0e.tm800127096.3456599500.7.248a49200OUhAc&pfilter=1010Badge_206366,"Layering is a cornerstone of creating visually interesting and dynamic outfits in both men's and women's fashion. It allows you to play with textures, colors, and proportions, adding depth and dimension to your look. Mastering the art of layering is all about creating a cohesive and balanced ensemble, one that complements your body type and flatters your silhouette. Start with a foundation – a basic tee, a fitted tank top, or a turtleneck. This forms the base layer, providing a starting point for building your outfit. The next layer offers opportunities for exploration. Experiment with button-down shirts, sweaters, vests, or kimonos. Choose pieces that complement the base layer – a fitted shirt over a loose tee for visual contrast, or a lightweight kimono over a tank top for a relaxed yet stylish vibe. Texture plays a crucial role in successful layering. Combine smooth fabrics like silk or satin with chunky knits or textured linens to create a visually engaging interplay. Don't be afraid to experiment with patterns! Stripes and florals can add personality when paired with solid-colored pieces. Remember, balance is key – a busy patterned shirt might work best with a simpler bottom layer. The bottom layer offers another opportunity for creative expression. Jeans, chinos, skirts, or dresses can all be utilized in layering. Tucking a shirt into high-waisted pants creates a defined waistline, while letting a longer shirt hang loose over a skirt adds a casual touch. When layering multiple garments, consider proportions. Balance a bulkier top with slimmer bottoms, or pair a flowy dress with a fitted jacket. Accessories are the finishing touch when it comes to layered looks. A statement necklace can elevate a simple outfit, while a chunky scarf adds warmth and texture. For colder weather, layer on a beanie or a fedora hat, and complete the look with a pair of stylish boots. Layering opens a world of possibilities for expressing your personal style, allowing you to create unique and fashionable looks for any occasion.",328
27/04/2024 15:59,Fashion_Beauty,Footwear: Stepping Out in Style,https://pages.daraz.pk/wow/gcp/daraz/channel/pk/-the-fashion-store/accessories-men?spm=a2a0e.tm800153859.9605157410.10.4d8f581apTXxy1&pfilter=1010Badge_202807,"Shoes can make or break an outfit. The right pair of footwear can elevate your look, adding a touch of personality and completing your overall style statement. Whether it's a pair of sleek heels for a night out, comfortable sneakers for everyday wear, or stylish boots for colder days, choosing the right shoes is essential. For women, heels come in a dazzling array of styles – pumps, stilettos, wedges, and platforms, each offering a unique look and feel. Pumps add instant sophistication, while wedges offer a touch of height with added comfort. Stilettos exude a sense of power and elegance, while platforms provide a stylish and trendy look. For a more casual vibe, flats are a versatile option. Loafers and ballet flats offer timeless elegance, while sneakers provide comfort and functionality. Ankle boots are a wardrobe staple, perfect for transitioning between seasons. They come in various styles, from sleek and sophisticated Chelsea boots to rugged combat boots. Men's footwear also offers a diverse range of options. Dress shoes, like oxfords and derbies, are essential for formal occasions. Loafers and boat shoes are ideal for smart casual looks, while sneakers reign supreme in the realm of comfort and everyday wear. Boots are a versatile choice for men as well, with options like Chelsea boots, work boots, and chukka boots to choose from. Beyond aesthetics, consider comfort when selecting footwear. Shoes that are too tight or uncomfortable can ruin your day. Choose shoes that fit well and provide adequate support, especially if you'll be on your feet for long periods. The right pair of shoes can transform your look, adding a touch of personality and completing your overall style statement. So, step out with confidence, knowing that your footwear is as stylish and comfortable as it is functional.",305
27/04/2024 15:59,Fashion_Beauty,The Allure of Vintage Fashion: A Timeless Treasure Trove ,https://pages.daraz.pk/wow/gcp/daraz/channel/pk/-beauty-station/makeup?spm=a2a0e.tm800127096.3456599500.3.248a49200OUhAc&pfilter=1010Badge_206366,"Vintage fashion holds a unique charm, offering a glimpse into a bygone era while remaining surprisingly relevant in today's world. These pre-loved garments tell stories, carrying the essence of the past. They exude a sense of quality and craftsmanship often lacking in fast-fashion pieces. For the fashion-conscious and eco-conscious consumer, vintage shopping offers a treasure trove of unique finds and a sustainable alternative to mass-produced clothing. Stepping into a vintage store is like embarking on a journey through time. You'll encounter a kaleidoscope of styles, from the whimsical silhouettes of the 1920s to the bold patterns of the 1970s. The beauty of vintage fashion lies in its diversity. Whether you crave the elegance of a classic trench coat or the rebellious spirit of a rock-and-roll leather jacket, there's a piece of vintage history waiting to be discovered. Beyond individual garments, vintage fashion provides a platform for personal expression. Curating a vintage wardrobe allows you to stand out from the crowd, breaking free from the monotony of mass-produced trends. Vintage pieces can become conversation starters, sparking curiosity about their origins and stories. However, navigating vintage fashion requires a bit of know-how. When shopping vintage, condition is key. Look for garments free of significant rips, tears, or stains. Consider the fit – some vintage pieces may require tailoring to flatter your body type. Embrace the unique sizing systems of the past – you might be surprised to find a hidden gem a size or two larger than your usual size. Finding vintage treasures requires dedication and a bit of adventure. Explore local thrift stores, vintage clothing shops, or online marketplaces. Be prepared to sift through racks and racks of clothing, as the hunt is often part of the fun! When you discover the perfect piece, it's a truly rewarding experience, like unearthing something rare and special.",302
